"7","Elwyn.Skiles","True","inventore aut nihil minima laudantium hic qui omnis"
"7","Elwyn.Skiles","True","provident aut nobis culpa"
"7","Elwyn.Skiles","True","ut asperiores perspiciatis veniam ipsum rerum saepe"
"7","Elwyn.Skiles","True","voluptatem libero consectetur rerum ut"
"7","Elwyn.Skiles","True","nulla aliquid eveniet harum laborum libero alias ut unde"
"7","Elwyn.Skiles","True","qui molestiae voluptatibus velit iure harum quisquam"
"7","Elwyn.Skiles","True","et labore eos enim rerum consequatur sunt"
"7","Elwyn.Skiles","True","placeat minima consequatur rem qui ut"
"7","Elwyn.Skiles","True","aut consectetur in blanditiis deserunt quia sed laboriosam"
